{
  "unit_id": "cau-7",
  "from": "2020-06-05T09:40:00.000Z",
  "to": "2020-06-05T09:41:12.000Z",
  "source": "ring",
  "series": [
    {
      "tag": "line_pressure",
      "kind": "analog",
      "unit": "bar",
      "points": [
        ["2020-06-05T09:40:00.000Z", 9.12],
        ["2020-06-05T09:40:18.000Z", 8.87],
        ["2020-06-05T09:40:36.000Z", null],
        ["2020-06-05T09:40:54.000Z", 8.51],
        ["2020-06-05T09:41:12.000Z", 8.34]
      ]
    },
    {
      "tag": "load_valve",
      "kind": "digital",
      "unit": "",
      "points": [
        ["2020-06-05T09:40:00.000Z", 1],
        ["2020-06-05T09:40:36.000Z", 0],
        ["2020-06-05T09:41:12.000Z", 1]
      ]
    }
  ],
  "discontinuities": ["2020-06-05T09:40:36.000Z"]
}
