{
  "unit_id": "cau-7",
  "from": "2020-02-01T00:00:00.000Z",
  "to": "2020-02-01T00:03:00.000Z",
  "source": "agg_1m",
  "series": [
    {
      "tag": "oil_temperature",
      "kind": "analog",
      "unit": "degC",
      "points": [
        ["2020-02-01T00:00:00.000Z", 58.4],
        ["2020-02-01T00:01:00.000Z", 59.1],
        ["2020-02-01T00:02:00.000Z", 60.2],
        ["2020-02-01T00:03:00.000Z", 61]
      ]
    }
  ],
  "discontinuities": []
}
